{
  "$schema": "./content-truth.schema.json",
  "schema_version": "1.0.0",
  "manifest_version": "1.0.0",
  "audit": {
    "audited_at": "2026-07-15",
    "repository_revision": "91dddac18ee2",
    "scope": [
      "Hardcoded identity, biography, availability, response-time, contact, positioning, capability, metric, testimonial, experience, education, course, social, resume, and legal claims rendered by public routes",
      "Repository-defined Project and Article records, public fallbacks, metadata, and publication assumptions",
      "Current five-pillar coverage in public source code"
    ],
    "limitations": [
      "This is a source-code audit, not proof of a person's identity, employment, education, client relationship, account ownership, or consent.",
      "No production database export, private worksheet, resume contents, certificates, contracts, analytics, or testimonial consent records were available or inspected.",
      "Publicly rendered contact values are redacted here to avoid duplicating personal data; their source locations remain listed.",
      "A repeated value in source code is not treated as independent real-world verification."
    ]
  },
  "status_contract": {
    "verified-by-code": "The statement is limited to deterministic behavior or configuration visible in this repository. It does not verify an external personal or commercial fact.",
    "needs-owner-verification": "The source currently asserts a real-world fact. Production publication is blocked until the owner confirms it and records an evidence/consent reference outside Git.",
    "remove": "The current value is contradictory, generic, unsafe as a factual fallback, unsupported social proof, simulated behavior, stale, or outside the approved positioning; it must not be published as truth.",
    "dynamic-derived": "The value must be calculated from production-visible, truth-approved records using the stated derivation rule and must never be typed as a marketing number."
  },
  "publication_contract": {
    "default_policy": "Deny publication unless a field is explicitly approved and its content_tier, verification_state, status, and visibility all pass the production gate.",
    "production": [
      "Use content_tier=production only; exclude demo and fixture records in repository/service queries, not only in the UI.",
      "Require verification_state=approved for every personal, employment, education, credential, client, testimonial, project-outcome, account-ownership, availability, response-time, and resume claim.",
      "Require status=published, is_deleted=false, and visibility=public; scheduled records must also be inside their publish window.",
      "Allow dynamic metrics only from the same production-visible, approved record set and return no metric when the source set is incomplete.",
      "A missing fact must omit the component or use neutral UI copy; it must never fall back to a person, role, date, category, outcome, or number.",
      "Testimonials require approved wording, identity/relationship, source reference, and publication consent as separate gates."
    ],
    "demo": [
      "Use content_tier=demo with deterministic demo IDs and an explicit synthetic=true marker.",
      "Demo mode must be enabled only outside production, carry a visible Demo label, and set noindex/nofollow.",
      "Synthetic names, companies, testimonials, clients, outcomes, employment, and education must never be copied into production seeds.",
      "Production APIs must reject attempts to publish demo or synthetic records."
    ],
    "private_evidence": [
      "Store evidence references, consent files, private contact details, client confidentiality notes, contracts, certificates, and resume source files outside Git with access control.",
      "The committed manifest may store only an opaque evidence reference state such as pending or approved; it must not store evidence URLs, document IDs, phone numbers, addresses, or confidential client details.",
      "Verification changes require verifier identity, timestamp, reason, and an audit event; revocation immediately removes the affected public claim."
    ]
  },
  "claims": [
    {
      "id": "identity.full-name",
      "category": "identity",
      "claim": "The portfolio owner and displayed author is Foysal Ahmed.",
      "current_public_value": "Foysal Ahmed",
      "status": "needs-owner-verification",
      "production_publish": "block",
      "sources": [
        {
          "path": "src/config/project/index.ts",
          "symbol_or_context": "PROJECT.name"
        },
        {
          "path": "src/app/layout.tsx",
          "symbol_or_context": "root metadata.title"
        },
        {
          "path": "src/components/partials/Header/index.tsx",
          "symbol_or_context": "Logo"
        },
        {
          "path": "src/components/partials/footer/index.tsx",
          "symbol_or_context": "brand and copyright"
        }
      ],
      "reason": "The value is internally consistent across source files, but source repetition is not independent identity proof.",
      "required_action": "Owner confirms the preferred public name and records a private verification reference; Site becomes the only public source."
    },
    {
      "id": "identity.canonical-url",
      "category": "identity",
      "claim": "The canonical portfolio URL is foysalahmedmin.com.",
      "current_public_value": "https://foysalahmedmin.com",
      "status": "needs-owner-verification",
      "production_publish": "block",
      "sources": [
        {
          "path": "src/config/project/index.ts",
          "symbol_or_context": "PROJECT.website"
        }
      ],
      "reason": "The repository declares the URL but contains no domain-ownership or deployment evidence.",
      "required_action": "Confirm domain ownership and the canonical protocol/host before publishing metadata or structured data."
    },
    {
      "id": "identity.official-portfolio",
      "category": "identity",
      "claim": "This application is the official portfolio of Foysal Ahmed.",
      "current_public_value": "Welcome to the official portfolio of Foysal Ahmed",
      "status": "needs-owner-verification",
      "production_publish": "block",
      "sources": [
        {
          "path": "src/app/(common)/(home)/page.tsx",
          "symbol_or_context": "metadata.description"
        }
      ],
      "reason": "Repository naming does not prove owner control of the deployment or approval of the word official.",
      "required_action": "Owner confirms the site identity and canonical deployment before official language is published."
    },
    {
      "id": "identity.default-locale",
      "category": "identity",
      "claim": "The application's current default document language is English.",
      "current_public_value": "en",
      "status": "verified-by-code",
      "production_publish": "allow",
      "sources": [
        {
          "path": "src/app/layout.tsx",
          "symbol_or_context": "html lang and bootstrap fallback"
        },
        {
          "path": "src/config/settings/index.ts",
          "symbol_or_context": "SETTINGS.language"
        }
      ],
      "reason": "This statement is only about deterministic application configuration.",
      "required_action": "Keep as an implementation default; do not reinterpret it as a personal fluency claim."
    },
    {
      "id": "identity.default-timezone",
      "category": "identity",
      "claim": "The application's configured default timezone is Asia/Dhaka.",
      "current_public_value": "Asia/Dhaka",
      "status": "verified-by-code",
      "production_publish": "allow",
      "sources": [
        {
          "path": "src/config/settings/index.ts",
          "symbol_or_context": "SETTINGS.timezone"
        }
      ],
      "reason": "This statement is limited to code configuration and does not prove physical residence.",
      "required_action": "Keep as a technical default or manage it in Site settings."
    },
    {
      "id": "media.legacy-portrait",
      "category": "media",
      "claim": "The file /images/profile.png is an approved genuine portrait of the owner.",
      "current_public_value": "/images/profile.png",
      "status": "remove",
      "production_publish": "block",
      "sources": [
        {
          "path": "src/components/(common)/home-page/about-section/index.tsx",
          "symbol_or_context": "about image"
        },
        {
          "path": "src/components/(common)/about-page/about-details-section/index.tsx",
          "symbol_or_context": "profile image"
        }
      ],
      "reason": "No provenance or owner approval is recorded, and the approved product direction prefers a non-human abstract identity visual.",
      "required_action": "Remove the portrait from public surfaces and replace it through the managed File pipeline with an approved non-human identity visual."
    },
    {
      "id": "contact.primary-email",
      "category": "contact",
      "claim": "The repeated Gmail address is the owner's approved public contact address.",
      "current_public_value": "[redacted: Gmail address currently hardcoded in public source]",
      "status": "needs-owner-verification",
      "production_publish": "block",
      "sources": [
        {
          "path": "src/components/partials/footer/index.tsx",
          "symbol_or_context": "Contact"
        },
        {
          "path": "src/components/(common)/about-page/about-details-section/index.tsx",
          "symbol_or_context": "Email"
        },
        {
          "path": "src/components/(common)/contact-page/contact-content-section/index.tsx",
          "symbol_or_context": "contactInfo"
        },
        {
          "path": "src/app/(common)/privacy/page.tsx",
          "symbol_or_context": "policy contact"
        },
        {
          "path": "src/app/(common)/terms/page.tsx",
          "symbol_or_context": "legal contact"
        }
      ],